Session.ID,Session.Title,Date,Start.Time,Location
12998,"Songs/Vocalizations: Morphologically, genetically and vocally divergent Warbling Vireo subspecies exhibit indiscriminate aggression toward intruders in a new contact zone",6/26/19,1445,4
13319,Songs/Vocalizations: What drives flexible signaling? Anthropogenic noise and social context affect male house wren vocal behavior,6/26/19,1500,4
12695,Songs/Vocalizations: Who is there? Response to different type of territorial intruders,6/26/19,1515,4
12875,Behavior: Social network metrics predict future social status in male lance-tailed manakins,6/26/19,1600,2
13099,Behavior: Effects of the Social Environment on Cloacal Microbiome Diversity,6/26/19,1615,2
13314,Behavior: Differences in foraging strategies among Common Loons overwintering on a large freshwater reservoir in northwest South Carolina,6/26/19,1630,2
13188,Behavior: Does object neophobia predict exploratory behavior in a free-living wild bird?,6/26/19,1645,2
13302,Behavior: Timing of breeding in American coots: bet-hedging against nest predation when reproductive performance declines with season,6/26/19,1700,2
13281,Behavior: Neighbor-stranger discrimination in a Neotropical suboscine bird: embracing behavioral complexity to uncover patterns,6/26/19,1715,2
12979,Conservation: Where in the world are migratory birds declining during the annual cycle? The winter survival of a near threatened shorebird in South America,6/26/19,1600,6
13374,Conservation: What factors influence nest survival of the endangered Yellow-headed Amazon?,6/26/19,1615,6
13324,"Conservation: Effects of translocation on burrowing owl (Athene cunicularia) survival, fidelity, and nesting rates in Arizona",6/26/19,1630,6
13321,Conservation: Landscape matrix and species traits mediate avian responses to forest fragmentation,6/26/19,1645,6
13004,"Conservation: Demographic consequences of road mortality to Snowy Plovers at Gulf Islands National Seashore, FL",6/26/19,1700,6
13271,"Conservation: When prioritizing regions for migratory bird habitat conservation, quantifying costs can supersede parametrizing a population model",6/26/19,1715,6
12876,Genomics/Systematics: Identifying and characterizing transposable element polymorphisms in the Northern Flicker (Colaptes auratus) species complex,6/26/19,1600,7
13236,Genomics/Systematics: Immigration may decouple heterozygosity and inbreeding in declining populations of Florida Scrub-Jays,6/26/19,1615,7
12904,Genomics/Systematics: Phylogeny of the Hawaiian Thrushes (Myadestes) Based on UCE and Mitochondrial DNA Sequences,6/26/19,1630,7
12788,Genomics/Systematics: Reconciling the mitonuclear compatibility species concept with rampant mitochondrial introgression,6/26/19,1645,7
12986,Genomics/Systematics: The Common Yellowthroat genoscape- a genomic approach to delineating conservation units,6/26/19,1700,7
13152,Genomics/Systematics: A genomic investigation of the potential despeciation of deeply divergent lineages in a Malagasy passerine,6/26/19,1715,7
12466,Human dimensions/Policy: Wedge-tailed Shearwater Persistence in Human-Dominated Areas,6/26/19,1600,8
12705,"Human dimensions/Policy: If You Build It, They Will Come: Avian Utilization and Predation at a Large-Scale Photovoltaic Solar Facility",6/26/19,1615,8
13490,Human dimensions/Policy: Engaging undergraduate students in an authentic course-based research experience using archived nest video footage,6/26/19,1630,8
13478,Human dimensions/Policy: The Nsf is Growing Pathways to Stem for Rural Community College Students via Community Partnerships and Intensive Mentoring,6/26/19,1645,8
13239,Human dimensions/Policy: Engaging with veterinarians to reduce cat overpopulation and cat impacts on wildlife populations,6/26/19,1700,8
12989,"Human dimensions/Policy: Evaluating bird feeders as tools to connect people with nature, and challenges associated with middle school interventions",6/26/19,1715,8
13251,Migration: Assessing optimality of migratory landbirds crossing the Gulf of Mexico using individual-based modeling of telemetry data,6/26/19,1600,5
12835,Migration: Movement and Distribution of Red Knots (Calidris canutus) in the Southeastern U.S,6/26/19,1615,5
13534,Migration: Movement patterns and habitat use of endangered whooping cranes during migration through Canada’s oil sands mining region,6/26/19,1630,5
13098,Migration: Revisiting Red-winged Blackbird Migration: Fine-scale Temporal and Spatial Movements of Individuals Across Annual Migration,6/26/19,1645,5
13228,"Migration: Age-, Sex-, and Size-Related Differences in the Distribution of Migrating Landbirds on the Northern Gulf Coast",6/26/19,1700,5
13149,Migration: Assessing the potential for using weather radar to predict bird collisions,6/26/19,1715,5
12641,Morphology/Molt: Simultaneous rectrix molt and comparative molt ecology of eastern wood-warblers,6/26/19,1600,4
13287,Morphology/Molt: Glare reduction properties of dark avian facial markings,6/26/19,1615,4
13240,Morphology/Molt: Evolution of molt-migration: a large-scale phylogenetic approach,6/26/19,1630,4
13355,Morphology/Molt: Molt-migration in the Mexican Monsoon: 90 years of specimens reveal a phenological mismatch caused by anthropogenic climate change,6/26/19,1645,4
12823,Morphology/Molt: The role of diet and nesting in bill shape diversification of frugivorous Asian barbets,6/26/19,1700,4
12666,"Urban ecology: Urban habitat use by the an Endangered Hawaiian waterbird on O'ahu, Hawaii",6/26/19,1600,3
13518,Urban ecology: Urbanization and elevated cholesterol in American crows,6/26/19,1615,3
12933,Urban ecology: Investigating the influence of polarized light and artificial night lighting on bird-building collisions,6/26/19,1630,3
13433,Urban ecology: Relationships between local- and landscape-scale management and urban bird communities across six major metropolitan areas: Do yards matter?,6/26/19,1645,3
13463,Urban ecology: Effects of habitat type on provisioning Florida Burrowing Owl space use and movements,6/26/19,1715,3
13263,Urban ecology: Songbirds alter their use of bird feeders in response to vocalization playback,6/26/19,1715,3
13362,Agriculture: GPS-tracking Reveals Selection for Prairie Ponds by Tree Swallows in Cropland-Dominated Landscapes,6/25/19,1030,3
12683,Agriculture: Impact of Wildfires on Barn Owl Habitat Selection in a Vineyard Agroecosystem in Napa Valley,6/25/19,1045,3
13230,Agriculture: Does a “Sonic Net” Protect Sunflower from Damage by Blackbirds?,6/25/19,1100,3
13283,Agriculture: Quantifying multiple-benefits of bird conservation in the agricultural mosaic of California’s Central Valley,6/25/19,1115,3
12722,Agriculture: Estimating the Effect of Prairie Strips on Grassland Birds,6/25/19,1130,3
13079,Agriculture: Comparing land-sparing and land-sharing conservation approaches in a coffee-growing region with high avian biodiversity,6/25/19,1145,3
12793,Biogeography: Climate delineates the northern range boundary of the Northern Cardinal,6/25/19,1030,2
13049,Biogeography: Montane biogeography and the evolution of disjunct ranges: a case study in the Diglossa flowerpiercers,6/25/19,1045,2
12474,Biogeography: Diversification and biogeography in an Indo-Pacific bird radiation (Pachycephalidae),6/25/19,1100,2
12773,Biogeography: Patterns and mechanisms of heterogeneous breeding distribution shifts in North American migratory birds,6/25/19,1115,2
13383,Biogeography: Is specialism an evolutionary dead-end? Estimates of transition rates between generalism and specialism in a New World clade,6/25/19,1130,2
12957,Biogeography: Cryptic bird species on a remote archipelago of the Pacific Ocean,6/25/19,1145,2
13502,Conservation/Popn Dynamics: Cutting out without losing out: subsampling soundscapes for long-term avian biodiversity monitoring,6/25/19,1030,5
12478,Conservation/Popn Dynamics: Spatial Models to Facilitate Broad-Scale Conservation of Breeding Habitat for Secretive Marsh Birds,6/25/19,1045,5
13392,Conservation/Popn Dynamics: Road Mortality in Barn Owls: Identifying Temporal and Spatial Hotspots in the Fraser Valley of British Columbia,6/25/19,1145,5
13468,Conservation/Popn Dynamics: A Bayesian network approach for improved seasonal distribution models of long-distance migratory passerines using Tyrannus flycatchers,6/25/19,1100,5
12905,Conservation/Popn Dynamics: Contrasting long-term population trends of beach-nesting shorebirds under shared environmental conditions,6/25/19,1115,5
12762,Conservation/Popn Dynamics: Investigation of population change in a hurricane affected Piping Plover population,6/25/19,1130,5
12681,Habitat relationships: Shrub encroachment alters distributions and demography of breeding birds in semiarid grasslands,6/25/19,1030,6
12975,Habitat relationships: Are We Sure About Shearing? Evaluating the Impact of a Widely Used but Poorly Assessed Habitat Management Practice,6/25/19,1045,6
12833,"Habitat relationships: Restoration Success: Avian Richness and Abundance Among 1,000 Acres of Restored San Francisco Bay Tidal Marsh Habitat, Based on Point Count Surveys That Employ Citizen Scientists",6/25/19,1100,6
12809,Habitat relationships: Post-fire nest site selection and survival of Black-backed Woodpeckers,6/25/19,1115,6
12867,Habitat relationships: Identifying critical nesting habitat for ducks in Alberta’s western boreal forest,6/25/19,1130,6
13061,Habitat relationships: Persistence in a Changing Landscape: Recurring Bird Concentration Areas on Alaska's Arctic Coastal Plain,6/25/19,1145,6
13253,Movements/Dispersal: Effects of source population and release strategy on reintroduced Scaled Quail mortality and dispersal,6/25/19,1030,7
12458,Movements/Dispersal: A burning question: Does personality predict how pre-breeding Florida Scrub-Jays explore habitat in a fire history mosaic?,6/25/19,1045,7
12710,Movements/Dispersal: Long-term dynamics of breeding dispersal distances by adult Northern Spotted Owls,6/25/19,1100,7
13285,Movements/Dispersal: Does experimental local extinction of a flowering plant affect hummingbird movement patterns?,6/25/19,1115,7
13487,Movements/Dispersal: Habitat Use and Foraging Flights of Roseate Spoonbills in Florida Bay,6/25/19,1130,7
13218,Movements/Dispersal: The allometry of movement and connectivity of bird communities,6/25/19,1145,7
13405,Phylogenetics/Phylogeography: Evolution of migration in the Nightingale-thrushes (Turdidae: Catharus) inferred via morphometric and phylogenetic analysis,6/25/19,1030,8
13363,Phylogenetics/Phylogeography: Multiple hybrid zones in a widespread Amazonian bird reveal different evolutionary processes,6/25/19,1045,8
13300,Phylogenetics/Phylogeography: Fine-scale genetic population structure of an understory bird (Thamnophilus atrinucha) across the Panama Canal Zone,6/25/19,1100,8
13051,Phylogenetics/Phylogeography: Comparative phylogeography of Amazonian riverine island birds,6/25/19,1115,8
13290,Phylogenetics/Phylogeography: Contrasting drivers of diversity and turnover in Andean birds and their parasites,6/25/19,1130,8
13344,Phylogenetics/Phylogeography: Resolving difficult nodes in manakin phylogeny using low-coverage whole genome sequencing,6/25/19,1145,8
12742,Population biology: Growth of two Atlantic Coast Piping Plover populations,6/25/19,1030,1
13320,Population biology: When the freezer breaks: will climate warming impact the persistence of resident birds in Alaska?,6/25/19,1045,1
13130,Population biology: Population genomics of Hawaiian House Finches (Haemorhous mexicanus): investigating genetic variation of an introduced population,6/25/19,1100,1
13159,Population biology: Using integrated models to identify ecology and population dynamics of a threatened arctic species,6/25/19,1115,1
13102,Population biology: Population dynamics of a long-distance migratory passerine at the edge of its range,6/25/19,1130,1
13286,Population biology: Using museum specimens to investigate fitness variation across avian hybrid zones,6/25/19,1145,1
13347,Sexual selection: Can male zebra finches perceive their own quality and adjust mate choice accordingly?,6/25/19,1030,9
13515,Sexual selection: Experimentally increasing perceived competition for nests reduces female reproductive performance and extra-pair offspring,6/25/19,1045,9
12849,Sexual selection: Male Red Carotenoid Coloration Indicates Mitochondrial Performance in the House Finch,6/25/19,1100,9
12814,"Sexual selection: Infanticide and Adoption in the Green-rumped Parrotlet: Killing Cavities, Remorseless Rogues and Betrayed Saints",6/25/19,1115,9
13139,Sexual selection: Within-pair annual and lifetime reproductive success drives the opportunity for sexual selection in black-throated blue warblers,6/25/19,1130,9
13520,"Sexual selection: Associations of the cloacal microbiome with sexual ornamentation, condition, sex and habitat in molting House Finches",6/25/19,1145,9
13311,Songs/Vocalizations: It's the same old song: benefits of song dialects in the Lapland Longspur,6/25/19,1030,4
12772,Songs/Vocalizations: Behavioral landscape of 'Oma'o vocalizations in a naturally fragmented habitat,6/25/19,1045,4
13091,Songs/Vocalizations: Behavioral and Spectrographic Analysis of Chatter: A Novel Vocalization in Northern Mockingbirds,6/25/19,1100,4
12952,Songs/Vocalizations: Repertoire size and individual variation in vocalizations of ʻŌmaʻo (Myadestes obscurus) an endemic Hawaiian thrush,6/25/19,1115,4
13364,Songs/Vocalizations: Deep Convolutional Neural Network to Detect Forest Owls of the Pacific Northwest,6/25/19,1130,4
12780,"Songs/Vocalizations: Sex and species divergence in vocalizations between role-reversed shorebirds, Jacana spinosa and Jacana jacana",6/25/19,1145,4
13449,Breeding biology: Can nest concealment in Wood Thrushes predict reproductive success?,6/25/19,1400,4
12724,"Breeding biology: Nest survival, predator assemblage, and patterns of predation at Veery (Catharus fuscescens) nests in a mature forest",6/25/19,1415,4
12911,Breeding biology: Viewing habitat through another lens: Bird nest-site selection and productivity across the beach thermal landscape,6/25/19,1430,4
13368,"Breeding biology: Intraspecific variation and adaptive significance of a little-known life-history trait, laying interval length, along a latitudinal gradient",6/25/19,1445,4
12965,Breeding biology: Macroevolutionary dynamics of egg colour and patterning,6/25/19,1500,4
13413,Breeding biology: To kill a mockingbird: the combined effects of two radically different parasites,6/25/19,1515,4
12961,Climate: Validating climate suitability projections: Community science reveals that birds track their ecological niche in summer and winter,6/25/19,1400,2
12792,Climate: Climate change threatens a songbird population through its impacts on breeding,6/25/19,1415,2
13217,Climate: Contrasting Demographic Responses of Eastern Bluebird Populations to Climatic Variability,6/25/19,1430,2
12690,Climate: Climate warming reduces population growth and recruitment rates over 30 years in an Afrotropical bird community,6/25/19,1445,2
13398,"Climate: Climate, storm-petrels, and chick growth",6/25/19,1500,2
13135,Climate: Using big data to assess the vulnerability of North American Birds to climate change,6/25/19,1515,2
13203,"Conservation: Forest management, habitat conservation and monitoring Northern Goshawks in Southeast Alaska",6/25/19,1445,5
13232,Conservation: Grassland bird response to spring cover crops in an agricultural landscape,6/25/19,1500,5
12830,Conservation: Experimental forest fragmentation alters interaction networks of Amazonian mixed-species flocks,6/25/19,1430,5
13201,Conservation: Cross-scale interaction effects of climate and forest patch size on the persistence of forest-interior birds,6/25/19,1400,5
12747,Conservation: Extinction debt and species credit in tropical forest bird communities: conservation implications for two biodiversity hotspots,6/25/19,1415,5
13423,Conservation: Using remote sensing of avian habitat to direct bird conservation,6/25/19,1515,5
12842,Evolution: A tale of two transects: sexual selection across a hummingbird hybrid zone,6/25/19,1400,9
13514,Evolution: Cultural Evolution Promotes Rapid Character Displacement in Sympatric Crossbills,6/25/19,1415,9
12928,Evolution: The relative roles of natural selection and sexual selection in speciation in the tanagers,6/25/19,1430,9
13547,Evolution: Pleistocene glacial cycles and the relative ease of speciation with periodic gene flow,6/25/19,1445,9
12659,Evolution: Early stage of the speciation process: Two coloration genes underlie species differences in a pair of capuchino seedeaters (Sporophila)”,6/25/19,1500,9
13500,Evolution: Signal evolution and morphological complexity in hummingbirds (Aves: Trochilidae),6/25/19,1515,9
13041,Migration: A Range-wide geolocator project fills critical knowledge gaps of our understanding of the full annual cycle of Cerulean Warblers,6/25/19,1400,7
12886,Migration: Phenology of the Purple Martin Annual Cycle,6/25/19,1415,7
13394,Migration: Conservation implications of a migratory network for the Common Nighthawk,6/25/19,1430,7
12945,Migration: Conservation in the Context of Migratory Connectivity: A Golden-winged Warbler Case Study,6/25/19,1445,7
13313,"Migration: Migratory pathways, stopover locations, and wintering destinations of Flammulated Owls breeding in Colorado",6/25/19,1500,7
13179,Migration: Full annual cycle ecologyof migratory birds in the lower Great Lakes,6/25/19,1515,7
12860,Phylogeography: Genomic Signatures of Pleistocene Dry Forest Connections in a Widespread South American Songbird,6/25/19,1400,8
12836,Phylogeography: Using ancient DNA from fossils to place an extinct flightless bird genus in a phylogenetic context,6/25/19,1415,8
13032,Phylogeography: Comparative phylogeography of four lowland forest birds distributed across the Dahomey Gap of West Africa,6/25/19,1430,8
13054,Phylogeography: Comparative genomics reveal modes of differentiation in North American warm desert birds,6/25/19,1445,8
13323,"Phylogeography: The Genetics of Adaptation and Diversification of the “Great Speciators,” the Wallacean Zosterops",6/25/19,1500,8
12972,Phylogeography: Testing the causes of speciation with gene flow in a Neotropical avian species pair (Pachyramphus aglaiae),6/25/19,1515,8
13265,"Abundance, occupancy, trends: eBird Status and Trends: Species Distributions and Population Trends with Citizen Science Data",6/25/19,1600,4
12679,"Abundance, occupancy, trends: Combining BBS and PIF Population Data to Estimate Recent Changes in Illinois’ Total Bird Population",6/25/19,1615,4
13210,"Abundance, occupancy, trends: Results from a decade of banding Yellow Rails in Oklahoma and Texas",6/25/19,1630,4
13422,"Abundance, occupancy, trends: Population trends and habitat associations of conservation priority bird species in Iowa",6/25/19,1645,4
12942,"Abundance, occupancy, trends: Do drones bug songbirds?",6/25/19,1700,4
13419,"Abundance, occupancy, trends: Risk Assessment of Great Lakes piping plovers using eABM: An R package to run Environment Agent-based Models",6/25/19,1715,4
13040,Climate: Characterizing a century of species losses in an isolated tropical forest fragment,6/25/19,1600,2
12794,Climate: Dominance in hummingbird communities: an alternative  way to visually represent it,6/25/19,1615,2
13489,Climate: Plague management on prairie dog colonies maintains habitat for grassland passerines and raptors,6/25/19,1630,2
12738,Climate: Behavioral niche partitioning reexamined: do behavioral foraging differences predict dietary differences?,6/25/19,1645,2
12735,Climate: Functional changes in assemblages of avian frugivores following extinction and invasion,6/25/19,1700,2
13245,"Climate: Shifts in avian community composition across a human-modified landscape in Borneo, Malaysia",6/25/19,1715,2
12662,Conservation: Fear of predators influences nestling condition across a suburbanization gradient,6/25/19,1600,5
13189,Conservation: Testing the proposed IUCN Green List categories and criteria,6/25/19,1615,5
13496,Conservation: Saving the Red Siskin (Spinus cucullatus): Managing new flock member introductions in captivity,6/25/19,1630,5
13010,Conservation: Conservation of tidal marsh sparrows in an urban setting referencing range wide nesting occurrence,6/25/19,1645,5
13365,"Conservation: Integrating genetic, population monitoring, and climate data to inform conservation of a declining migratory bird",6/25/19,1700,5
12717,Conservation: Response of a southern California riparian bird community to habitat destruction by the invasive Kuroshio shot hole borer,6/25/19,1715,5
13166,Life history/Behavior: Evolution of polygyny in weaverbirds (family Ploceidae),6/25/19,1600,9
13506,Life history/Behavior: Patterns and causes of tropical montane life histories: an observational and experimental study in Malaysian Borneo,6/25/19,1615,9
13395,Life history/Behavior: Quantifying trade-offs in migration and reproduction in long-distance migratory birds of contrasting life history,6/25/19,1630,9
13090,Life history/Behavior: Timing is of the essence: later breeding predicts lower survival in American kestrels (Falco sparverius),6/25/19,1645,9
13297,Life history/Behavior: Loggers in artificial eggs reveal scarlet macaw incubation in natural and artificial nests,6/25/19,1700,9
12929,Life history/Behavior: Application of a novel nest density estimator: an example using sagebrush-steppe songbirds,6/25/19,1715,9
13100,Migration: Satellite tracking a wide‑ranging endangered vulture species to target conservation actions in the Middle East and East Africa,6/25/19,1600,7
13161,Migration: Synthesis of migration ecology in the Gulf of Mexico guides species conservation,6/25/19,1615,7
13476,Migration: Messy eaters: DNA on dirty talons and beaks reveal what a migrating raptor eats,6/25/19,1630,7
13406,Migration: Winter ecology and spring migration timing of Swainson’s Thrush using forest and shade coffee plantations in Colombia,6/25/19,1645,7
13268,Migration: Population-Level Importance and Migratory Connectivity of a Shorebird Staging Site in the Midcontinental Flyway,6/25/19,1700,7
13050,Migration: Idiosyncratic changes in spring arrival dates of Pacific Northwest migratory birds,6/25/19,1715,7
13326,Phylogenetics: Genomic and phenotypic divergence in Red Warblers (Cardellina rubra),6/25/19,1600,8
13282,Phylogenetics: A Phylogenomic Tree of Screech-Owls: Elucidating the Evolution of Color Polymorphism and its Ecological Correlates,6/25/19,1615,8
12829,Phylogenetics: Phylogenomics of the Parrots of the World,6/25/19,1630,8
12700,Phylogenetics: Phylogenomics of pigeons and doves from whole genome sequencing,6/25/19,1645,8
13063,Phylogenetics: Wild Turkey speciation seen through full genomes,6/25/19,1700,8
12888,Phylogenetics: Molecular phylogeny of whistling ducks (Dendrocygninae),6/25/19,1715,8
12414,Lightning Talks: Long-term data show shifts in urban bird communities by land use type in Arizona,6/27/19,1030,7
13484,Lightning Talks: Nesting sites and declining snowpack co-limit habitat of North Americas highest-elevation breeding bird,6/27/19,1035,7
13497,Lightning Talks: Diversity of grassland bird communities as a function of grazer species on the Northern Great Plains,6/27/19,1040,7
13117,Lightning Talks: Differential effects of landscape composition and patch size on avian habitat use of restored fields in agriculturally fragmented landscapes,6/27/19,1045,7
13462,"Lightning Talks: Fast Relief: Immediate Benefits From Reducing Invasive,  Non-native Overpopulations Of Canada Goose Via Addling Their Eggs",6/27/19,1050,7
13485,Lightning Talks: Patterns of change within the avian community of Acadia National Park: long-term changes and a case study in human development,6/27/19,1055,7
13428,Lightning Talks: Quantifying snag resources for cavity-nesting birds and Red-cockaded Woodpecker cavity usurpation in old-growth longleaf pine,6/27/19,1100,7
12944,Lightning Talks: Is Kluane Lake in the Yukon Territory a superhighway for Alaska’s migrating Golden Eagles?,6/27/19,1105,7
13103,"Lightning Talks: Earlier spring arrival of migrant birds at the Aras Ornithological Research Station, Igdir, Turkey",6/27/19,1110,7
12791,Lightning Talks: Nocturnal flight calls influence vulnerability to artificial light and building collision,6/27/19,1115,7
13350,"Lightning Talks: Winter Movement of Brown-capped Rosy-Finches (Leucosticte australis) between Feeder Sites in Colorado, USA",6/27/19,1120,7
13304,Lightning Talks: Habitat Use of Hawaiian Short-eared Owls (Asio flammeus sandwichensis) in Hawai‘i,6/27/19,1125,7
,Lightning Talks: ,6/27/19,1130,7
13105,Lightning Talks: Mexican hummingbird nesting,6/26/19,1030,9
13503,Lightning Talks: Colorful and Calm or Angry and Ornamented: Correlated Nest Defense and Uv and Melanin Ornaments in Eastern Bluebirds,6/26/19,1035,9
13457,Lightning Talks: Social polygyny and genetic confirmation using minION DNA sequencing in the Eastern Bluebird,6/26/19,1040,9
13214,Lightning Talks: Individual distinctiveness in vocalizations of a suboscine songbird,6/26/19,1045,9
13351,Lightning Talks: Cross –species Responsiveness to Auditory Stimuli:  Do Birds and Humans React to Similar Sounds in Similar Ways?,6/26/19,1050,9
13444,Lightning Talks: Painting the Bunting: The molecular and structural basis for coloration of Painted Bunting (Passerina ciris),6/26/19,1055,9
13360,Lightning Talks: Dynamics of remigial molt of captive spectacled (Somateria fischeri) and Steller’s eiders (Polysticta stelleri),6/26/19,1100,9
12917,Lightning Talks: Bill Divergence and Speciation in the New World Jays (Corvidae),6/26/19,1105,9
13507,"Lightning Talks: Connecting the Dots: Identifying Melanistic Pathways in a Polymorphic Raptor, Buteo jamaicensis harlani",6/26/19,1110,9
